{
  "contractName": "IERC1155Receiver",
  "sourceName": "@openzeppelin/contracts/token/ERC1155/IERC1155Receiver.sol",
  "abi": [
    {
      "inputs": [
        {
          "internalType": "address",
          "name": "operator",
          "type": "address"
        },
        {
          "internalType": "address",
          "name": "from",
          "type": "address"
        },
        {
          "internalType": "uint256[]",
          "name": "ids",
          "type": "uint256[]"
        },
        {
          "internalType": "uint256[]",
          "name": "values",
          "type": "uint256[]"
        },
        {
          "internalType": "bytes",
          "name": "data",
          "type": "bytes"
        }
      ],
      "name": "onERC1155BatchReceived",
      "outputs": [
        {
          "internalType": "bytes4",
          "name": "",
          "type": "bytes4"
        }
      ],
      "stateMutability": "nonpayable",
      "type": "function"
    },
    {
      "inputs": [
        {
          "internalType": "address",
          "name": "operator",
          "type": "address"
        },
        {
          "internalType": "address",
          "name": "from",
          "type": "address"
        },
        {
          "internalType": "uint256",
          "name": "id",
          "type": "uint256"
        },
        {
          "internalType": "uint256",
          "name": "value",
          "type": "uint256"
        },
        {
          "internalType": "bytes",
          "name": "data",
          "type": "bytes"
        }
      ],
      "name": "onERC1155Received",
      "outputs": [
        {
          "internalType": "bytes4",
          "name": "",
          "type": "bytes4"
        }
      ],
      "stateMutability": "nonpayable",
      "type": "function"
    },
    {
      "inputs": [
        {
          "internalType": "bytes4",
          "name": "interfaceId",
          "type": "bytes4"
        }
      ],
      "name": "supportsInterface",
      "outputs": [
        {
          "internalType": "bool",
          "name": "",
          "type": "bool"
        }
      ],
      "stateMutability": "view",
      "type": "function"
    }
  ],
  "bytecode": "0x",
  "deployedBytecode": "0x",
  "linkReferences": {},
  "deployedLinkReferences": {},
  "devdoc": {
    "kind": "dev",
    "methods": {
      "onERC1155BatchReceived(address,address,uint256[],uint256[],bytes)": {
        "details": "Handles the receipt of a multiple ERC1155 token types. This function is called at the end of a `safeBatchTransferFrom` after the balances have been updated. To accept the transfer(s), this must return `bytes4(keccak256(\"onERC1155BatchReceived(address,address,uint256[],uint256[],bytes)\"))` (i.e. 0xbc197c81, or its own function selector).",
        "params": {
          "data": "Additional data with no specified format",
          "from": "The address which previously owned the token",
          "ids": "An array containing ids of each token being transferred (order and length must match values array)",
          "operator": "The address which initiated the batch transfer (i.e. msg.sender)",
          "values": "An array containing amounts of each token being transferred (order and length must match ids array)"
        },
        "returns": {
          "_0": "`bytes4(keccak256(\"onERC1155BatchReceived(address,address,uint256[],uint256[],bytes)\"))` if transfer is allowed"
        }
      },
      "onERC1155Received(address,address,uint256,uint256,bytes)": {
        "details": "Handles the receipt of a single ERC1155 token type. This function is called at the end of a `safeTransferFrom` after the balance has been updated. To accept the transfer, this must return `bytes4(keccak256(\"onERC1155Received(address,address,uint256,uint256,bytes)\"))` (i.e. 0xf23a6e61, or its own function selector).",
        "params": {
          "data": "Additional data with no specified format",
          "from": "The address which previously owned the token",
          "id": "The ID of the token being transferred",
          "operator": "The address which initiated the transfer (i.e. msg.sender)",
          "value": "The amount of tokens being transferred"
        },
        "returns": {
          "_0": "`bytes4(keccak256(\"onERC1155Received(address,address,uint256,uint256,bytes)\"))` if transfer is allowed"
        }
      },
      "supportsInterface(bytes4)": {
        "details": "Returns true if this contract implements the interface defined by `interfaceId`. See the corresponding https://eips.ethereum.org/EIPS/eip-165#how-interfaces-are-identified[EIP section] to learn more about how these ids are created. This function call must use less than 30 000 gas."
      }
    },
    "version": 1
  },
  "evm": {
    "bytecode": {
      "generatedSources": [],
      "linkReferences": {},
      "object": "",
      "opcodes": "",
      "sourceMap": ""
    },
    "deployedBytecode": {
      "generatedSources": [],
      "immutableReferences": {},
      "linkReferences": {},
      "object": "",
      "opcodes": "",
      "sourceMap": ""
    },
    "gasEstimates": null,
    "methodIdentifiers": {
      "onERC1155BatchReceived(address,address,uint256[],uint256[],bytes)": "bc197c81",
      "onERC1155Received(address,address,uint256,uint256,bytes)": "f23a6e61",
      "supportsInterface(bytes4)": "01ffc9a7"
    }
  },
  "metadata": "{\"compiler\":{\"version\":\"0.7.6+commit.7338295f\"},\"language\":\"Solidity\",\"output\":{\"abi\":[{\"inputs\":[{\"internalType\":\"address\",\"name\":\"operator\",\"type\":\"address\"},{\"internalType\":\"address\",\"name\":\"from\",\"type\":\"address\"},{\"internalType\":\"uint256[]\",\"name\":\"ids\",\"type\":\"uint256[]\"},{\"internalType\":\"uint256[]\",\"name\":\"values\",\"type\":\"uint256[]\"},{\"internalType\":\"bytes\",\"name\":\"data\",\"type\":\"bytes\"}],\"name\":\"onERC1155BatchReceived\",\"outputs\":[{\"internalType\":\"bytes4\",\"name\":\"\",\"type\":\"bytes4\"}],\"stateMutability\":\"nonpayable\",\"type\":\"function\"},{\"inputs\":[{\"internalType\":\"address\",\"name\":\"operator\",\"type\":\"address\"},{\"internalType\":\"address\",\"name\":\"from\",\"type\":\"address\"},{\"internalType\":\"uint256\",\"name\":\"id\",\"type\":\"uint256\"},{\"internalType\":\"uint256\",\"name\":\"value\",\"type\":\"uint256\"},{\"internalType\":\"bytes\",\"name\":\"data\",\"type\":\"bytes\"}],\"name\":\"onERC1155Received\",\"outputs\":[{\"internalType\":\"bytes4\",\"name\":\"\",\"type\":\"bytes4\"}],\"stateMutability\":\"nonpayable\",\"type\":\"function\"},{\"inputs\":[{\"internalType\":\"bytes4\",\"name\":\"interfaceId\",\"type\":\"bytes4\"}],\"name\":\"supportsInterface\",\"outputs\":[{\"internalType\":\"bool\",\"name\":\"\",\"type\":\"bool\"}],\"stateMutability\":\"view\",\"type\":\"function\"}],\"devdoc\":{\"kind\":\"dev\",\"methods\":{\"onERC1155BatchReceived(address,address,uint256[],uint256[],bytes)\":{\"details\":\"Handles the receipt of a multiple ERC1155 token types. This function is called at the end of a `safeBatchTransferFrom` after the balances have been updated. To accept the transfer(s), this must return `bytes4(keccak256(\\\"onERC1155BatchReceived(address,address,uint256[],uint256[],bytes)\\\"))` (i.e. 0xbc197c81, or its own function selector).\",\"params\":{\"data\":\"Additional data with no specified format\",\"from\":\"The address which previously owned the token\",\"ids\":\"An array containing ids of each token being transferred (order and length must match values array)\",\"operator\":\"The address which initiated the batch transfer (i.e. msg.sender)\",\"values\":\"An array containing amounts of each token being transferred (order and length must match ids array)\"},\"returns\":{\"_0\":\"`bytes4(keccak256(\\\"onERC1155BatchReceived(address,address,uint256[],uint256[],bytes)\\\"))` if transfer is allowed\"}},\"onERC1155Received(address,address,uint256,uint256,bytes)\":{\"details\":\"Handles the receipt of a single ERC1155 token type. This function is called at the end of a `safeTransferFrom` after the balance has been updated. To accept the transfer, this must return `bytes4(keccak256(\\\"onERC1155Received(address,address,uint256,uint256,bytes)\\\"))` (i.e. 0xf23a6e61, or its own function selector).\",\"params\":{\"data\":\"Additional data with no specified format\",\"from\":\"The address which previously owned the token\",\"id\":\"The ID of the token being transferred\",\"operator\":\"The address which initiated the transfer (i.e. msg.sender)\",\"value\":\"The amount of tokens being transferred\"},\"returns\":{\"_0\":\"`bytes4(keccak256(\\\"onERC1155Received(address,address,uint256,uint256,bytes)\\\"))` if transfer is allowed\"}},\"supportsInterface(bytes4)\":{\"details\":\"Returns true if this contract implements the interface defined by `interfaceId`. See the corresponding https://eips.ethereum.org/EIPS/eip-165#how-interfaces-are-identified[EIP section] to learn more about how these ids are created. This function call must use less than 30 000 gas.\"}},\"version\":1},\"userdoc\":{\"kind\":\"user\",\"methods\":{},\"notice\":\"_Available since v3.1._\",\"version\":1}},\"settings\":{\"compilationTarget\":{\"@openzeppelin/contracts/token/ERC1155/IERC1155Receiver.sol\":\"IERC1155Receiver\"},\"evmVersion\":\"istanbul\",\"libraries\":{},\"metadata\":{\"bytecodeHash\":\"ipfs\",\"useLiteralContent\":true},\"optimizer\":{\"enabled\":true,\"runs\":200},\"remappings\":[]},\"sources\":{\"@openzeppelin/contracts/introspection/IERC165.sol\":{\"content\":\"// SPDX-License-Identifier: MIT\\n\\npragma solidity ^0.7.0;\\n\\n/**\\n * @dev Interface of the ERC165 standard, as defined in the\\n * https://eips.ethereum.org/EIPS/eip-165[EIP].\\n *\\n * Implementers can declare support of contract interfaces, which can then be\\n * queried by others ({ERC165Checker}).\\n *\\n * For an implementation, see {ERC165}.\\n */\\ninterface IERC165 {\\n    /**\\n     * @dev Returns true if this contract implements the interface defined by\\n     * `interfaceId`. See the corresponding\\n     * https://eips.ethereum.org/EIPS/eip-165#how-interfaces-are-identified[EIP section]\\n     * to learn more about how these ids are created.\\n     *\\n     * This function call must use less than 30 000 gas.\\n     */\\n    function supportsInterface(bytes4 interfaceId) external view returns (bool);\\n}\\n\",\"keccak256\":\"0xd2f30fad5b24c4120f96dbac83aacdb7993ee610a9092bc23c44463da292bf8d\",\"license\":\"MIT\"},\"@openzeppelin/contracts/token/ERC1155/IERC1155Receiver.sol\":{\"content\":\"// SPDX-License-Identifier: MIT\\n\\npragma solidity ^0.7.0;\\n\\nimport \\\"../../introspection/IERC165.sol\\\";\\n\\n/**\\n * _Available since v3.1._\\n */\\ninterface IERC1155Receiver is IERC165 {\\n\\n    /**\\n        @dev Handles the receipt of a single ERC1155 token type. This function is\\n        called at the end of a `safeTransferFrom` after the balance has been updated.\\n        To accept the transfer, this must return\\n        `bytes4(keccak256(\\\"onERC1155Received(address,address,uint256,uint256,bytes)\\\"))`\\n        (i.e. 0xf23a6e61, or its own function selector).\\n        @param operator The address which initiated the transfer (i.e. msg.sender)\\n        @param from The address which previously owned the token\\n        @param id The ID of the token being transferred\\n        @param value The amount of tokens being transferred\\n        @param data Additional data with no specified format\\n        @return `bytes4(keccak256(\\\"onERC1155Received(address,address,uint256,uint256,bytes)\\\"))` if transfer is allowed\\n    */\\n    function onERC1155Received(\\n        address operator,\\n        address from,\\n        uint256 id,\\n        uint256 value,\\n        bytes calldata data\\n    )\\n        external\\n        returns(bytes4);\\n\\n    /**\\n        @dev Handles the receipt of a multiple ERC1155 token types. This function\\n        is called at the end of a `safeBatchTransferFrom` after the balances have\\n        been updated. To accept the transfer(s), this must return\\n        `bytes4(keccak256(\\\"onERC1155BatchReceived(address,address,uint256[],uint256[],bytes)\\\"))`\\n        (i.e. 0xbc197c81, or its own function selector).\\n        @param operator The address which initiated the batch transfer (i.e. msg.sender)\\n        @param from The address which previously owned the token\\n        @param ids An array containing ids of each token being transferred (order and length must match values array)\\n        @param values An array containing amounts of each token being transferred (order and length must match ids array)\\n        @param data Additional data with no specified format\\n        @return `bytes4(keccak256(\\\"onERC1155BatchReceived(address,address,uint256[],uint256[],bytes)\\\"))` if transfer is allowed\\n    */\\n    function onERC1155BatchReceived(\\n        address operator,\\n        address from,\\n        uint256[] calldata ids,\\n        uint256[] calldata values,\\n        bytes calldata data\\n    )\\n        external\\n        returns(bytes4);\\n}\\n\",\"keccak256\":\"0x9cd66d9f2777cf22eedebe5f1e56d87d1582393ab5be121fe1d935464d371283\",\"license\":\"MIT\"}},\"version\":1}",
  "storageLayout": {
    "storage": [],
    "types": null
  },
  "userdoc": {
    "kind": "user",
    "methods": {},
    "notice": "_Available since v3.1._",
    "version": 1
  }
}